{
  "$schema": "https://json-schema.org/draft/2020-12/schema",
  "$id": "faff/commissaire-facade/v0.3/conformed-to-contract",
  "title": "conformed_to_contract (kind_of_entry: conformed_to_contract)",
  "description": "The terminal verdict `verdict conclude` appends on the clean path: the governor's Ed25519-signed statement that a work unit's evidence concluded under the contract, having checked for escapes. Always author==commissaire. `conformed_to_contract` is the stored kind; `conclude` is the CLI action. Conclusions written before FAFF-1221 carry `accepted_under_contract` and are read through v0.2 (see ../records.md). A conclude on a unit with zero ledger records is refused (`no-evidence`) and writes nothing. Shape normative here; semantics in ../records.md.",
  "type": "object",
  "additionalProperties": false,
  "required": ["schema", "run_id", "seq", "ts", "author", "producer_id", "contract_revision", "kind_of_entry", "unit_id", "step", "prev", "payload", "commissaire_sig"],
  "properties": {
    "schema": { "type": "integer", "enum": [3] },
    "run_id": { "type": "string" },
    "seq": { "type": "integer" },
    "ts": { "type": "string" },
    "author": { "type": "string", "enum": ["commissaire"] },
    "producer_id": { "type": "string" },
    "contract_revision": { "type": "string" },
    "kind_of_entry": { "type": "string", "enum": ["conformed_to_contract"] },
    "unit_id": { "type": "string" },
    "step": { "type": "string" },
    "prev": { "type": "string" },
    "payload": {
      "type": "object",
      "additionalProperties": false,
      "required": ["producer_id", "contract_revision", "evidence_seq_range", "escapes_checked"],
      "properties": {
        "producer_id": { "type": "string" },
        "contract_revision": { "type": "string" },
        "evidence_seq_range": { "type": "array", "items": { "type": "integer" }, "description": "[min seq, max seq] over the unit's entries this verdict concludes" },
        "escapes_checked": { "type": "boolean", "description": "true — conclude refuses on any unreconciled escape before signing" }
      }
    },
    "commissaire_sig": { "type": "string" }
  }
}
